270;Viljandi Vana Apteek;Viljandi maakond - Viljandi linn Tallinna tn 2;OÜ Viljandi Vana-Apteek;Ei;Punane;Põhiapteek;Viljandi maakond;Suuremas linnas (vähemalt 4000 elanikku);;;
2101;Viljandi Vana Apteek HA1;Viljandi maakond Kõpu vald Kõpu alevik Viljandi mnt 4;OÜ Viljandi Vana-Apteek;Ei;Punane;Haruapteek;Viljandi maakond;Maal;;;
2284;Viljandi Vana Apteek HA2;Viljandi maakond Viljandi vald Jämejala küla Pärna tee 3;OÜ Viljandi Vana-Apteek;Ei;Punane;Haruapteek;Viljandi maakond;Maal;;;
220;Vinni Apteek;Lääne-Viru maakond Vinni vald Vinni alevik Sõpruse tn 1a;Osaühing Salvare Apteek;Jah;Roheline;Põhiapteek;Lääne-Viru maakond;Maal;;;
247;Virbi Apteek;Harju maakond Tallinn Lasnamäe linnaosa Virbi tn 4;Osaühing EstELIN & K;Jah;Roheline;Põhiapteek;Harju maakond;Suuremas linnas (vähemalt 4000 elanikku);;;
1436;Virbi Euroapteek;Harju maakond Tallinn Lasnamäe linnaosa Virbi tn 12;OÜ Kvatropharma;Jah;Roheline;Põhiapteek;Harju maakond;Suuremas linnas (vähemalt 4000 elanikku);;;
1376;Vironia Keskuse Apteek;Ida-Viru maakond Kohtla-Järve linn Järve linnaosa Järveküla tee 50;Terve Pere Apteek OÜ;Ei;Punane;Põhiapteek;Ida-Viru maakond;Suuremas linnas (vähemalt 4000 elanikku);;;
56;Viru Apteek;Ida-Viru maakond - Sillamäe linn Viru pst 2;Terve Pere Apteek OÜ;Ei;Punane;Põhiapteek;Ida-Viru maakond;Suuremas linnas (vähemalt 4000 elanikku);;;
214;Viru Platsi Apteek;Harju maakond Tallinn Kesklinna linnaosa Gonsiori tn 3;BENU Apteek Eesti OÜ;Ei;Punane;Põhiapteek;Harju maakond;Suuremas linnas (vähemalt 4000 elanikku);;;
2306;Viru Platsi Apteek HA1;Harju maakond Rae vald Jüri alevik Aruküla tee 29;BENU Apteek Eesti OÜ;Ei;Punane;Haruapteek;Harju maakond;Maal;;;
1452;Viru Puiestee Apteek;Ida-Viru maakond Sillamäe linn Viru pst 22b;OÜ KONVALLARIA ;Jah;Roheline;Põhiapteek;Ida-Viru maakond;Suuremas linnas (vähemalt 4000 elanikku);;;
1340;Viru Südameapteek;Lääne-Viru maakond - Rakvere linn Laada tn 20;Pharma Group OÜ;Ei;Punane;Põhiapteek;Lääne-Viru maakond;Suuremas linnas (vähemalt 4000 elanikku);;;
2322;Viru Südameapteek HA2;Lääne-Viru maakond Kadrina vald Kadrina alevik Viitna tee 4;Pharma Group OÜ;Ei;Punane;Haruapteek;Lääne-Viru maakond;Maal;;;
57;Virumaa Apteek;Lääne-Viru maakond - Rakvere linn Laada tn 27;BENU Apteek Eesti OÜ;Ei;Punane;Põhiapteek;Lääne-Viru maakond;Suuremas linnas (vähemalt 4000 elanikku);;;
2125;Virumaa Apteek HA1;Lääne-Viru maakond - Rakvere linn Tuleviku tn 1;BENU Apteek Eesti OÜ;Ei;Punane;Haruapteek;Lääne-Viru maakond;Suuremas linnas (vähemalt 4000 elanikku);;;
2243;Virumaa Apteek HA2;Lääne-Viru maakond Haljala vald Haljala alevik Rakvere mnt 3;BENU Apteek Eesti OÜ;Ei;Punane;Haruapteek;Lääne-Viru maakond;Maal;;;
2329;Virumaa Apteek HA3;Lääne-Viru maakond Väike-Maarja vald Väike-Maarja alevik Pikk tn 12;BENU Apteek Eesti OÜ;Ei;Punane;Haruapteek;Lääne-Viru maakond;Maal;;;
143;Võnnu Apteek;Tartu maakond Kastre vald Võnnu alevik Tartu tn 22;OÜ VÕNNU APTEEK;Jah;Roheline;Põhiapteek;Tartu maakond;Maal;;;
2013;Võnnu Apteek HA1;Tartu maakond Kastre vald Melliste küla Järve põik 5;OÜ VÕNNU APTEEK;Jah;Roheline;Haruapteek;Tartu maakond;Maal;;;
2171;Võnnu Apteek HA2;Põlva maakond Põlva vald Mooste alevik Järveotsa tee 3;OÜ VÕNNU APTEEK;Jah;Roheline;Haruapteek;Põlva maakond;Maal;;;
2268;Võnnu Apteek HA3;Tartu maakond Kastre vald Roiu alevik Kesktänav 9;OÜ VÕNNU APTEEK;Jah;Roheline;Haruapteek;Tartu maakond;Maal;;;
169;Võru Apteek;Võru maakond - Võru linn Vabaduse tn 10b;BENU Apteek Eesti OÜ;Ei;Punane;Põhiapteek;Võru maakond;Suuremas linnas (vähemalt 4000 elanikku);;;
27;Võru Maksimarketi Südameapteek;Võru maakond Võru linn Jüri tn 83;Pharma Group OÜ;Ei;Punane;Põhiapteek;Võru maakond;Suuremas linnas (vähemalt 4000 elanikku);;;
1322;Võru Polikliiniku Südameapteek;Võru maakond - Võru linn Jüri tn 19a;Pharma Group OÜ;Ei;Punane;Põhiapteek;Võru maakond;Suuremas linnas (vähemalt 4000 elanikku);;;
1384;Võru Rimi Apteek;Võru maakond - Võru linn Jüri tn 85;BENU Apteek Eesti OÜ;Ei;Punane;Põhiapteek;Võru maakond;Suuremas linnas (vähemalt 4000 elanikku);;;
212;Võru Väike Apteek;Võru maakond - Võru linn Jüri tn 21;Osaühing Sella MT;Jah;Roheline;Põhiapteek;Võru maakond;Suuremas linnas (vähemalt 4000 elanikku);;;
1403;Väike-Maarja Apteek;Lääne-Viru maakond Väike-Maarja vald Väike-Maarja alevik Ravi tn 1;V-M ApteeK OÜ;Jah;Roheline;Põhiapteek;Lääne-Viru maakond;Maal;;;
101;Vändra Turu Apteek;Pärnu maakond Vändra vald (alev) Vändra alev Turu tn 6b;osaühing Folia Apteek;Jah;Roheline;Põhiapteek;Pärnu maakond;Maal;;;
100;Vändra Vana Apteek;Pärnu maakond Põhja-Pärnumaa vald Vändra alev Vihtra tee 4;osaühing Gvander;Jah;Roheline;Põhiapteek;Pärnu maakond;Maal;;;
2115;Vändra Vana Apteek HA1;Pärnu maakond Põhja-Pärnumaa vald Vändra alev Pärnu-Paide mnt 21;osaühing Gvander;Jah;Roheline;Haruapteek;Pärnu maakond;Maal;;;
120;Õismäe Apteek;Harju maakond Tallinn Haabersti linnaosa Õismäe tee 1b;BENU Apteek Eesti OÜ;Ei;Punane;Põhiapteek;Harju maakond;Suuremas linnas (vähemalt 4000 elanikku);;;
2213;Õismäe Apteek HA2;Harju maakond Tallinn Kesklinna linnaosa Sadama tn 6;BENU Apteek Eesti OÜ;Ei;Punane;Haruapteek;Harju maakond;Suuremas linnas (vähemalt 4000 elanikku);;;
91;Ülejõe Apteek;Pärnu maakond - Pärnu linn J. V. Jannseni tn 7a;OÜ Lartim;Jah;Roheline;Põhiapteek;Pärnu maakond;Suuremas linnas (vähemalt 4000 elanikku);;;
2197;Ülejõe Apteek HA2;Pärnu maakond - Pärnu linn Sadama tn 15;OÜ Lartim;Ei;Kollane;Haruapteek;Pärnu maakond;Suuremas linnas (vähemalt 4000 elanikku);;;
2259;Ülejõe Apteek HA3;Pärnu maakond Tori vald Sindi linn Jaama tn 8;OÜ Lartim;Jah;Roheline;Haruapteek;Pärnu maakond;Alla 4000 elanikuga linnas;;;
2336;Ülejõe Apteek HA4;Pärnu maakond, Pärnu linn, Tõstamaa alevik, Varbla mnt 24;OÜ Lartim;Jah;Roheline;Haruapteek;Pärnu maakond;Maal;;;
2346;Ülejõe Apteek HA5;Pärnu maakond Halinga vald Pärnu-Jaagupi alev Uus tn 20a;OÜ Lartim;Jah;Roheline;Haruapteek;Pärnu maakond;Maal;;;
2347;Ülejõe Apteek HA6;Pärnu maakond Pärnu linn Audru alevik Pärna allee 7;OÜ Lartim;Jah;Roheline;Haruapteek;Pärnu maakond;Maal;;;
231;Ülejõe Selveri Apteek;Pärnu maakond - Pärnu linn Tallinna mnt 93a;Terve Pere Apteek OÜ;Ei;Punane;Põhiapteek;Pärnu maakond;Suuremas linnas (vähemalt 4000 elanikku);;;
1401;Ülemiste Keskuse Südameapteek;Harju maakond Tallinn Lasnamäe linnaosa Suur-Sõjamäe tn 4;Pharma Group OÜ;Ei;Punane;Põhiapteek;Harju maakond;Suuremas linnas (vähemalt 4000 elanikku);;;
1162;Ülemiste Südameapteek;Harju maakond Tallinn Lasnamäe linnaosa Suur-Sõjamäe tn 4;Pharma Group OÜ;Ei;Punane;Põhiapteek;Harju maakond;Suuremas linnas (vähemalt 4000 elanikku);;;
1468;Ülemiste Tervisemaja Apteek;Harju maakond, Tallinn, Lasnamäe linnaosa, Valukoja tn 7/2-Karl Papello maja;Nordic Pharmacy OÜ;Jah;Roheline;Põhiapteek;Harju maakond;Suuremas linnas (vähemalt 4000 elanikku);;;
2338;Ülemiste Tervisemaja Apteek HA1;Viljandi maakond, Põhja-Sakala vald, Suure-Jaani linn, Pärnu tn 4;Nordic Pharmacy OÜ;Jah;Roheline;Haruapteek;Viljandi maakond;Alla 4000 elanikuga linnas;;;
2343;Ülemiste Tervisemaja Apteek HA2;Jõgeva maakond, Põltsamaa vald, Põltsamaa linn, Tartu mnt 1b;Nordic Pharmacy OÜ;Jah;Roheline;Haruapteek;Jõgeva maakond;Alla 4000 elanikuga linnas;;;
1326;Ümera Apteek;Harju maakond Tallinn Lasnamäe linnaosa Laagna tee 80;Osaühing EUROAPTEEK;Ei;Punane;Põhiapteek;Harju maakond;Suuremas linnas (vähemalt 4000 elanikku);;;
2323;Ümera Apteek HA2;Harju maakond Jõelähtme vald Loo alevik Saha tee 9;Osaühing EUROAPTEEK;Ei;Punane;Haruapteek;Harju maakond;Maal;;;
;;;;;;;;;;;
;;;;;;;;;;;
;;;;;;;;;;;
;;;;;;;;;;;
