181;Põlva Apteek;Põlva maakond Põlva vald Põlva linn Mäe tn 2a;osaühing PÕLVA APTEEK;Jah;Roheline;Põhiapteek;Põlva maakond;Suuremas linnas (vähemalt 4000 elanikku);;;
2050;Põlva Apteek HA1;Põlva maakond Põlva vald Ahja alevik Tartu mnt 21;osaühing PÕLVA APTEEK;Jah;Roheline;Haruapteek;Põlva maakond;Maal;;;
2279;Põlva Apteek HA3;Võru maakond, Setomaa vald, Värska alevik, Pikk tn 30;osaühing PÕLVA APTEEK;Jah;Roheline;Haruapteek;Võru maakond;Maal;;;
1431;Põlva EDU Keskuse Apteek;Põlva maakond Põlva vald Põlva linn Aasa tn 1;Kaguapteek OÜ;Jah;Roheline;Põhiapteek;Põlva maakond;Suuremas linnas (vähemalt 4000 elanikku);;;
1462;Põlva Maksimarketi Apteek;Põlva maakond, Põlva vald, Põlva linn, Ringtee tn 4;osaühing PÕLVA APTEEK;Jah;Roheline;Põhiapteek;Põlva maakond;Suuremas linnas (vähemalt 4000 elanikku);;;
188;Põlva Tervisekeskuse Südameapteek;Põlva maakond Põlva vald Põlva linn Uus tn 2;Pharma Group OÜ;Ei;Punane;Põhiapteek;Põlva maakond;Suuremas linnas (vähemalt 4000 elanikku);;;
2078;Põlva Tervisekeskuse Südameapteek HA1;Põlva maakond Põlva vald Põlva linn Jaama tn 12a;Pharma Group OÜ;Ei;Punane;Haruapteek;Põlva maakond;Suuremas linnas (vähemalt 4000 elanikku);;;
2195;Põlva Tervisekeskuse Südameapteek HA2;Põlva maakond Põlva vald Põlva linn Kesk tn 10;Pharma Group OÜ;Ei;Punane;Haruapteek;Põlva maakond;Suuremas linnas (vähemalt 4000 elanikku);;;
273;Pärnu Keskuse Südameapteek;Pärnu maakond - Pärnu linn Aida tn 7;Pharma Group OÜ;Ei;Punane;Põhiapteek;Pärnu maakond;Suuremas linnas (vähemalt 4000 elanikku);;;
89;Pärnu Linnaapteek;Pärnu maakond - Pärnu linn Pikk tn 11;Helania OÜ;Jah;Roheline;Põhiapteek;Pärnu maakond;Suuremas linnas (vähemalt 4000 elanikku);;;
2079;Pärnu Linnaapteek HA1;Pärnu maakond - Pärnu linn Karja tn 4;Helania OÜ;Ei;Kollane;Haruapteek;Pärnu maakond;Suuremas linnas (vähemalt 4000 elanikku);;;
2196;Pärnu Linnaapteek HA2;Pärnu maakond Kihnu vald Linaküla ;Helania OÜ;Jah;Roheline;Haruapteek;Pärnu maakond;Maal;;;
1405;Pärnu Maksimarketi Südameapteek;Pärnu maakond Pärnu linn Papsaare küla Haapsalu mnt 43;Pharma Group OÜ;Ei;Punane;Põhiapteek;Pärnu maakond;Maal;;;
2292;Pärnu Maksimarketi Südameapteek HA1;Pärnu maakond, Pärnu linn, Paikuse alev, Pärnade pst 1;Pharma Group OÜ;Ei;Punane;Haruapteek;Pärnu maakond;Maal;;;
1325;Pärnu Rüütli Apteek;Pärnu maakond - Pärnu linn Rüütli tn 30;OÜ Jasmin Apteegid;Ei;Punane;Põhiapteek;Pärnu maakond;Suuremas linnas (vähemalt 4000 elanikku);;;
81;Pärnu Turu Südameapteek;Pärnu maakond - Pärnu linn Suur-Sepa tn 18;Pharma Group OÜ;Ei;Punane;Põhiapteek;Pärnu maakond;Suuremas linnas (vähemalt 4000 elanikku);;;
19;Raasiku Apteek;Harju maakond Raasiku vald Raasiku alevik Tallinna mnt 19;Osaühing Raasiku Apteek;Jah;Roheline;Põhiapteek;Harju maakond;Maal;;;
2149;Raasiku Apteek HA1;Harju maakond Raasiku vald Aruküla alevik Piiri tn 12a;Osaühing Raasiku Apteek;Jah;Roheline;Haruapteek;Harju maakond;Maal;;;
63;Raatuse Apteek;Tartu maakond - Tartu linn Raatuse tn 20;osaühing TARTU UUSAPTEEK;Jah;Roheline;Põhiapteek;Tartu maakond;Suuremas linnas (vähemalt 4000 elanikku);;;
137;Raekoja Apteek;Tartu maakond - Tartu linn Raekoja plats 1a;Terve Pere Apteek OÜ;Ei;Punane;Põhiapteek;Tartu maakond;Suuremas linnas (vähemalt 4000 elanikku);;;
2012;Raekoja Apteek HA1;Tartu maakond - Tartu linn Riia tn 1;Terve Pere Apteek OÜ;Ei;Punane;Haruapteek;Tartu maakond;Suuremas linnas (vähemalt 4000 elanikku);;;
2170;Raekoja Apteek HA2;Tartu maakond - Tartu linn Narva mnt 112;Terve Pere Apteek OÜ;Ei;Punane;Haruapteek;Tartu maakond;Suuremas linnas (vähemalt 4000 elanikku);;;
1332;Rahu Apteek;Ida-Viru maakond - Narva linn Pähklimäe tn 6a;Osaühing EUROAPTEEK;Ei;Punane;Põhiapteek;Ida-Viru maakond;Suuremas linnas (vähemalt 4000 elanikku);;;
2165;Rahu Apteek HA1;Ida-Viru maakond - Sillamäe linn Viru pst 35;Osaühing EUROAPTEEK;Ei;Punane;Haruapteek;Ida-Viru maakond;Suuremas linnas (vähemalt 4000 elanikku);;;
2258;Rahu Apteek HA2;Ida-Viru maakond Kohtla-Järve linn Ahtme linnaosa Maleva tn 23;Osaühing EUROAPTEEK;Ei;Punane;Haruapteek;Ida-Viru maakond;Suuremas linnas (vähemalt 4000 elanikku);;;
2270;Rahu Apteek HA3;Ida-Viru maakond - Narva linn Mõisa tn 8;Osaühing EUROAPTEEK;Ei;Punane;Haruapteek;Ida-Viru maakond;Suuremas linnas (vähemalt 4000 elanikku);;;
1474;Raja Südameapteek;Tartu maakond, Tartu linn Raja tn 31;Veerenni apteek OÜ;Jah;Roheline;Põhiapteek;Tartu maakond;Suuremas linnas (vähemalt 4000 elanikku);;;
71;Rakke Apteek;Lääne-Viru maakond Väike-Maarja vald Rakke alevik F. R. Faehlmanni tee 30;Rakke Apteek Osaühing;Jah;Roheline;Põhiapteek;Lääne-Viru maakond;Maal;;;
321;Rakvere Keskväljaku Apteek;Lääne-Viru maakond - Rakvere linn L. Koidula tn 1;Terve Pere Apteek OÜ;Ei;Punane;Põhiapteek;Lääne-Viru maakond;Suuremas linnas (vähemalt 4000 elanikku);;;
1455;Rakvere Laada Apteek;Lääne-Viru maakond - Rakvere linn Laada tn 39;OÜ PharmaOne;Jah;Roheline;Põhiapteek;Lääne-Viru maakond;Suuremas linnas (vähemalt 4000 elanikku);;;
58;Rakvere Maxima Südameapteek;Lääne-Viru maakond - Rakvere linn Tallinna tn 11;Pharma Group OÜ;Ei;Punane;Põhiapteek;Lääne-Viru maakond;Suuremas linnas (vähemalt 4000 elanikku);;;
2302;Rakvere Maxima Südameapteek HA1;Lääne-Viru maakond, Viru-Nigula vald, Aseri alevik, Tehase tn 23;Pharma Group OÜ;Ei;Punane;Haruapteek;Lääne-Viru maakond;Maal;;;
1424;Rakvere Vaala Keskuse Apteek;Lääne-Viru maakond - Rakvere linn Lõõtspilli tn 2;OÜ PharmaTwo;Jah;Roheline;Põhiapteek;Lääne-Viru maakond;Suuremas linnas (vähemalt 4000 elanikku);;;
244;Ranna Apteek;Pärnu maakond - Pärnu linn Pärna tn 12;Osaühing Ranna Apteek;Jah;Roheline;Põhiapteek;Pärnu maakond;Suuremas linnas (vähemalt 4000 elanikku);;;
45;Rapla Apteek;Rapla maakond Rapla vald Rapla linn Hariduse tn 3;BENU Apteek Eesti OÜ;Ei;Punane;Põhiapteek;Rapla maakond;Suuremas linnas (vähemalt 4000 elanikku);;;
1387;Raudalu Südameapteek;Harju maakond Tallinn Nõmme linnaosa Viljandi mnt 41a;Pharma Group OÜ;Ei;Punane;Põhiapteek;Harju maakond;Suuremas linnas (vähemalt 4000 elanikku);;;
233;Ravana Apteek;Tartu maakond - Tartu linn Võru tn 77;BENU Apteek Eesti OÜ;Ei;Punane;Põhiapteek;Tartu maakond;Suuremas linnas (vähemalt 4000 elanikku);;;
2328;Ravana Apteek HA2;Valga maakond Otepää vald Otepää linn Lipuväljak 28;BENU Apteek Eesti OÜ;Ei;Punane;Haruapteek;Valga maakond;Alla 4000 elanikuga linnas;;;
1341;Retke tee BENU Apteek;Harju maakond Tallinn Kristiine linnaosa Tuisu tn 30;BENU Apteek Eesti OÜ;Ei;Punane;Põhiapteek;Harju maakond;Suuremas linnas (vähemalt 4000 elanikku);;;
16;Revali Raeapteek;Harju maakond Tallinn Kesklinna linnaosa Raekoja plats 11;Terve Pere Apteek OÜ;Ei;Punane;Põhiapteek;Harju maakond;Suuremas linnas (vähemalt 4000 elanikku);;;
1460;Riia Maja Apteek;Pärnu maakond - Pärnu linn Riia mnt 169a;Helania OÜ;Jah;Roheline;Põhiapteek;Pärnu maakond;Suuremas linnas (vähemalt 4000 elanikku);;;
1454;Ringi Apteek;Järva maakond, Türi vald, Türi linn, Tallinna tn 4;Nordic Pharmacy OÜ;Jah;Roheline;Põhiapteek;Järva maakond;Suuremas linnas (vähemalt 4000 elanikku);;;
277;Ringtee Selveri Südameapteek;Tartu maakond - Tartu linn Aardla tn 114;Veerenni apteek OÜ;Jah;Roheline;Põhiapteek;Tartu maakond;Suuremas linnas (vähemalt 4000 elanikku);;;
2191;Ringtee Selveri Südameapteek HA2;Tartu maakond - Tartu linn L. Puusepa tn 3;Veerenni apteek OÜ;Ei;Kollane;Haruapteek;Tartu maakond;Suuremas linnas (vähemalt 4000 elanikku);;;
35;Risti Apteek;Lääne maakond Lääne-Nigula vald Risti alevik Jaama tn 1;osaühing RISTI APTEEK;Ei;Punane;Põhiapteek;Lääne maakond;Maal;;;
1354;Rocca al Mare Apteek;Harju maakond Tallinn Haabersti linnaosa Paldiski mnt 102;OÜ Jasmin Apteegid;Ei;Punane;Põhiapteek;Harju maakond;Suuremas linnas (vähemalt 4000 elanikku);;;
2294;Rocca al Mare Apteek HA1;Harju maakond Saue vald Laagri alevik Veskitammi tn 10;OÜ Jasmin Apteegid;Ei;Punane;Haruapteek;Harju maakond;Maal;;;
274;Rocca al Mare Keskuse Apteek;Harju maakond Tallinn Haabersti linnaosa Paldiski mnt 102;Terve Pere Apteek OÜ;Ei;Punane;Põhiapteek;Harju maakond;Suuremas linnas (vähemalt 4000 elanikku);;;
172;Rõuge Apteek;Võru maakond Rõuge vald Rõuge alevik Sänna mnt 4;OÜ Rõuge Apteek;Jah;Roheline;Põhiapteek;Võru maakond;Maal;;;
185;Räpina Apteek;Põlva maakond Räpina vald Räpina linn Võru mnt 1a;osaühing RÄPINA APTEEK;Ei;Kollane;Põhiapteek;Põlva maakond;Alla 4000 elanikuga linnas;;;
1323;Räpina Südameapteek;Põlva maakond Räpina vald Räpina linn Kooli tn 14a;Pharma Group OÜ;Ei;Punane;Põhiapteek;Põlva maakond;Alla 4000 elanikuga linnas;;;
1412;Saare Selveri Südameapteek;Saare maakond - Kuressaare linn Tallinna tn 67;Pharma Group OÜ;Ei;Punane;Põhiapteek;Saare maakond;Suuremas linnas (vähemalt 4000 elanikku);;;
49;Saaremaa Apteek;Saare maakond - Kuressaare linn Lossi tn 1;osaühing Saaremaa Apteek;Jah;Roheline;Põhiapteek;Saare maakond;Suuremas linnas (vähemalt 4000 elanikku);;;
116;Saku Südameapteek;Harju maakond Saku vald Saku alevik Juubelitammede tee 6;Pharma Group OÜ;Ei;Punane;Põhiapteek;Harju maakond;Maal;;;
1400;Saue Grossi BENU Apteek;Harju maakond - Saue linn Pärnasalu põik 1b;BENU Apteek Eesti OÜ;Ei;Punane;Põhiapteek;Harju maakond;Suuremas linnas (vähemalt 4000 elanikku);;;
1427;Saue Ladva Apteek;Harju maakond - Saue linn Kuuseheki tn 2;OÜ Kvatropharma;Jah;Roheline;Põhiapteek;Harju maakond;Suuremas linnas (vähemalt 4000 elanikku);;;
300;Selma Apteek;Harju maakond Tallinn Kesklinna linnaosa Lastekodu tn 11a;BENU Apteek Eesti OÜ;Ei;Punane;Põhiapteek;Harju maakond;Suuremas linnas (vähemalt 4000 elanikku);;;
60;Seminari Südameapteek;Lääne-Viru maakond - Rakvere linn Seminari tn 3;Pharma Group OÜ;Ei;Punane;Põhiapteek;Lääne-Viru maakond;Suuremas linnas (vähemalt 4000 elanikku);;;
1335;Sepa Keskuse Apteek;Tartu maakond - Tartu linn Sepa tn 21;BENU Apteek Eesti OÜ;Ei;Punane;Põhiapteek;Tartu maakond;Suuremas linnas (vähemalt 4000 elanikku);;;
2319;Sepa Keskuse Apteek HA1;Tartu maakond Elva vald Rõngu alevik Viljandi mnt 2;BENU Apteek Eesti OÜ;Ei;Punane;Haruapteek;Tartu maakond;Maal;;;
1321;Siili Apteek;Harju maakond Tallinn Mustamäe linnaosa Sõpruse pst 171;Osaühing EUROAPTEEK;Ei;Punane;Põhiapteek;Harju maakond;Suuremas linnas (vähemalt 4000 elanikku);;;
2158;Siili Apteek HA1;Harju maakond Tallinn Nõmme linnaosa Valdeku tn 114;Osaühing EUROAPTEEK;Ei;Punane;Haruapteek;Harju maakond;Suuremas linnas (vähemalt 4000 elanikku);;;
2218;Siili Apteek HA2;Harju maakond Tallinn Mustamäe linnaosa Kiili tn 16;Osaühing EUROAPTEEK;Ei;Punane;Haruapteek;Harju maakond;Suuremas linnas (vähemalt 4000 elanikku);;;
248;Sikupilli Apteek;Harju maakond Tallinn Lasnamäe linnaosa Tartu mnt 87;BENU Apteek Eesti OÜ;Ei;Punane;Põhiapteek;Harju maakond;Suuremas linnas (vähemalt 4000 elanikku);;;
2305;Sikupilli Apteek HA1;Harju maakond Kose vald Kose alevik Kodu tn 2;BENU Apteek Eesti OÜ;Ei;Punane;Haruapteek;Harju maakond;Maal;;;
1398;Sikupilli Keskuse Südameapteek;Harju maakond Tallinn Lasnamäe linnaosa Tartu mnt 87;Pharma Group OÜ;Ei;Punane;Põhiapteek;Harju maakond;Suuremas linnas (vähemalt 4000 elanikku);;;
1447;Sillamäe Maksimarketi Apteek;Ida-Viru maakond Sillamäe linn Viru pst 5;OÜ KONVALLARIA;Jah;Roheline;Põhiapteek;Ida-Viru maakond;Suuremas linnas (vähemalt 4000 elanikku);;;
1463;Sillamäe Pavlovi Apteek;Ida-Viru maakond, Sillamäe linn, I. Pavlovi tn 1a;OÜ PharmaThree;Jah;Roheline;Põhiapteek;Ida-Viru maakond;Suuremas linnas (vähemalt 4000 elanikku);;;
1369;Sitsi Apteek;Harju maakond Tallinn Põhja-Tallinna linnaosa Kopli tn 35b;Osaühing EUROAPTEEK;Ei;Punane;Põhiapteek;Harju maakond;Suuremas linnas (vähemalt 4000 elanikku);;;
1374;Smuuli Apteek;Harju maakond Tallinn Lasnamäe linnaosa J. Smuuli tee 9;Osaühing EUROAPTEEK;Ei;Punane;Põhiapteek;Harju maakond;Suuremas linnas (vähemalt 4000 elanikku);;;
74;Soldino Apteek;Ida-Viru maakond - Narva linn Mõisa tn 5;Osaühing LABELIA;Jah;Roheline;Põhiapteek;Ida-Viru maakond;Suuremas linnas (vähemalt 4000 elanikku);;;
1423;Stockmanni Apteek;Harju maakond Tallinn Kesklinna linnaosa Liivalaia tn 53;OÜ PharmaOne;Jah;Roheline;Põhiapteek;Harju maakond;Suuremas linnas (vähemalt 4000 elanikku);;;
183;Stroomi Keskuse Apteek;Harju maakond Tallinn Põhja-Tallinna linnaosa Tuulemaa tn 20;Terve Pere Apteek OÜ;Ei;Punane;Põhiapteek;Harju maakond;Suuremas linnas (vähemalt 4000 elanikku);;;
1330;Suurejõe Apteek;Pärnu maakond - Pärnu linn Suur-Jõe tn 57;BENU Apteek Eesti OÜ;Ei;Punane;Põhiapteek;Pärnu maakond;Suuremas linnas (vähemalt 4000 elanikku);;;
8;Suur-Pärnu Apteek;Harju maakond Tallinn Kesklinna linnaosa Pärnu mnt 76;BENU Apteek Eesti OÜ;Ei;Punane;Põhiapteek;Harju maakond;Suuremas linnas (vähemalt 4000 elanikku);;;
2114;Suur-Pärnu Apteek HA1;Harju maakond Tallinn Kesklinna linnaosa Narva mnt 1;BENU Apteek Eesti OÜ;Ei;Punane;Haruapteek;Harju maakond;Suuremas linnas (vähemalt 4000 elanikku);;;
152;Sõbra Selveri Apteek;Tartu maakond - Tartu linn Sõbra tn 56;BENU Apteek Eesti OÜ;Ei;Punane;Põhiapteek;Tartu maakond;Suuremas linnas (vähemalt 4000 elanikku);;;
2209;Sõbra Selveri Apteek HA2;Tartu maakond - Tartu linn Turu tn 14;BENU Apteek Eesti OÜ;Ei;Punane;Haruapteek;Tartu maakond;Suuremas linnas (vähemalt 4000 elanikku);;;
1456;Sõle Südameapteek;Harju maakond, Tallinn, Põhja-Tallinna linnaosa, Sõle tn 16;Osaühing Pelgulinna Apteek ;Jah;Roheline;Põhiapteek;Harju maakond;Suuremas linnas (vähemalt 4000 elanikku);;;
1406;Sõpruse Rimi Südameapteek;Harju maakond Tallinn Kristiine linnaosa Sõpruse pst 174;Pharma Group OÜ;Ei;Punane;Põhiapteek;Harju maakond;Suuremas linnas (vähemalt 4000 elanikku);;;
1457;T1 Apteek;Harju maakond, Tallinn, Lasnamäe linnaosa, Peterburi tee 2;Apt.Est OÜ;Jah;Roheline;Põhiapteek;Harju maakond;Suuremas linnas (vähemalt 4000 elanikku);;;
1469;Tabasalu Tervisekeskuse apteek;Harju maakond Harku vald Tabasalu alevik Teenuste tn 2;Tabasalu Apteek OÜ;Jah;Roheline;Põhiapteek;Harju maakond;Maal;;;
148;Tabivere Apteek;Tartu maakond Tartu vald Tabivere alevik Tuuliku tn 8;Tabivere Apteek OÜ;Jah;Roheline;Põhiapteek;Tartu maakond;Maal;;;
2;Tallinna Linnaapteek Solarises;Harju maakond Tallinn Kesklinna linnaosa Estonia pst 9;Terve Pere Apteek OÜ;Ei;Punane;Põhiapteek;Harju maakond;Suuremas linnas (vähemalt 4000 elanikku);;;
2057;Tallinna Linnaapteek Solarises HA1;Harju maakond Tallinn Kesklinna linnaosa Ravi tn 18;Terve Pere Apteek OÜ;Ei;Punane;Haruapteek;Harju maakond;Suuremas linnas (vähemalt 4000 elanikku);;;
2300;Tallinna Linnaapteek Solarises HA3;Harju maakond Viimsi vald Haabneeme alevik Sõpruse tee 15;Terve Pere Apteek OÜ;Ei;Punane;Haruapteek;Harju maakond;Maal;;;
1368;Tallinna Maantee Apteek;Saare maakond - Kuressaare linn Tallinna tn 64;Osaühing EUROAPTEEK;Ei;Punane;Põhiapteek;Saare maakond;Suuremas linnas (vähemalt 4000 elanikku);;;
38;Tamme Apteek;Tartu maakond - Tartu linn L. Puusepa tn 1a;Terve Pere Apteek OÜ;Ei;Punane;Põhiapteek;Tartu maakond;Suuremas linnas (vähemalt 4000 elanikku);;;
2273;Tamme Apteek HA1;Lääne maakond Lääne-Nigula vald Kullamaa küla ;Terve Pere Apteek OÜ;Ei;Punane;Haruapteek;Lääne maakond;Maal;;;
290;Tammiku Apteek;Ida-Viru maakond Kohtla-Järve linn Ahtme linnaosa Ridaküla tn 10-26;Osaühing FARMACOR QUATRA;Jah;Roheline;Põhiapteek;Ida-Viru maakond;Suuremas linnas (vähemalt 4000 elanikku);;;
2119;Tammiku Apteek HA1;Ida-Viru maakond Kohtla-Järve linn Oru linnaosa Männi tn 3;Osaühing FARMACOR QUATRA;Ei;Kollane;Haruapteek;Ida-Viru maakond;Suuremas linnas (vähemalt 4000 elanikku);;;
70;Tamsalu Uus Apteek;Lääne-Viru maakond Tapa vald Tamsalu linn Tehnika tn 1a;Osaühing Tamsalu Uus Apteek;Jah;Roheline;Põhiapteek;Lääne-Viru maakond;Alla 4000 elanikuga linnas;;;
64;Tapa Apteek;Lääne-Viru maakond Tapa vald Tapa linn Pikk tn 33;BENU Apteek Eesti OÜ;Ei;Punane;Põhiapteek;Lääne-Viru maakond;Suuremas linnas (vähemalt 4000 elanikku);;;
2326;Tapa Apteek HA1;Harju maakond Loksa linn Tallinna tn 36;BENU Apteek Eesti OÜ;Ei;Punane;Haruapteek;Harju maakond;Alla 4000 elanikuga linnas;;;
280;Tapa Grossi Keskuse Apteek;Lääne-Viru maakond Tapa vald Tapa linn Jaama tn 1;BENU Apteek Eesti OÜ;Ei;Punane;Põhiapteek;Lääne-Viru maakond;Suuremas linnas (vähemalt 4000 elanikku);;;
2325;Tapa Grossi Keskuse Apteek HA3;Lääne-Viru maakond Haljala vald Võsu alevik Mere tn 63a;BENU Apteek Eesti OÜ;Ei;Punane;Haruapteek;Lääne-Viru maakond;Maal;;;
1438;Tapa Konsumi Apteek;Lääne-Viru maakond Tapa vald Tapa linn Kivilo tn 3;OSAÜHING JÕHVI APTEEK;Jah;Roheline;Põhiapteek;Lääne-Viru maakond;Suuremas linnas (vähemalt 4000 elanikku);;;
1339;Tapa Südameapteek;Lääne-Viru maakond Tapa vald Tapa linn Valgejõe pst 14/2;Pharma Group OÜ;Ei;Punane;Põhiapteek;Lääne-Viru maakond;Suuremas linnas (vähemalt 4000 elanikku);;;
2332;Tartu Kalda Suur  Apteek HA1;Lääne-Viru maakond Tapa vald Tamsalu linn Koidu tn 16;OÜ Pharmandia;Jah;Roheline;Haruapteek;Lääne-Viru maakond;Alla 4000 elanikuga linnas;;;
1410;Tartu Kalda Suur Apteek;Tartu maakond, Tartu linn, Tartu linn, Kalda tee 15;OÜ Pharmandia;Jah;Roheline;Põhiapteek;Tartu maakond;Suuremas linnas (vähemalt 4000 elanikku);;;
126;Tartu Kesklinna Südameapteek;Tartu maakond - Tartu linn Küüni tn 7;Pharma Group OÜ;Ei;Punane;Põhiapteek;Tartu maakond;Suuremas linnas (vähemalt 4000 elanikku);;;
1334;Tartu Küüni Apteek;Tartu maakond - Tartu linn Küüni tn 5b;OÜ Jasmin Apteegid;Ei;Punane;Põhiapteek;Tartu maakond;Suuremas linnas (vähemalt 4000 elanikku);;;
1310;Tartu Ringtee Südameapteek;Tartu maakond - Tartu linn Ringtee tn 60a;Pharma Group OÜ;Ei;Punane;Põhiapteek;Tartu maakond;Suuremas linnas (vähemalt 4000 elanikku);;;
1338;Tartu Sõbra Apteek;Tartu maakond - Tartu linn Sõbra tn 58;BENU Apteek Eesti OÜ;Ei;Punane;Põhiapteek;Tartu maakond;Suuremas linnas (vähemalt 4000 elanikku);;;
2316;Tartu Sõbra Apteek HA1;Tartu maakond Luunja vald Veibri küla Kasesalu tee 51;BENU Apteek Eesti OÜ;Ei;Punane;Haruapteek;Tartu maakond;Maal;;;
85;Tartu Turu Südameapteek;Tartu maakond - Tartu linn Soola tn 7;Pharma Group OÜ;Ei;Punane;Põhiapteek;Tartu maakond;Suuremas linnas (vähemalt 4000 elanikku);;;
322;Tasku Apteek;Tartu maakond - Tartu linn Turu tn 2;Terve Pere Apteek OÜ;Ei;Punane;Põhiapteek;Tartu maakond;Suuremas linnas (vähemalt 4000 elanikku);;;
2009;Tasku Apteek HA1;Tartu maakond - Tartu linn Võru tn 55f;Terve Pere Apteek OÜ;Ei;Punane;Haruapteek;Tartu maakond;Suuremas linnas (vähemalt 4000 elanikku);;;
2169;Tasku Apteek HA2;Tartu maakond - Tartu linn Ringtee tn 75a;Terve Pere Apteek OÜ;Ei;Punane;Haruapteek;Tartu maakond;Suuremas linnas (vähemalt 4000 elanikku);;;
1366;Telliskivi Apteek;Harju maakond Tallinn Põhja-Tallinna linnaosa Telliskivi tn 61;Osaühing EUROAPTEEK;Ei;Punane;Põhiapteek;Harju maakond;Suuremas linnas (vähemalt 4000 elanikku);;;
179;Tiimanni Apteek;Ida-Viru maakond - Narva linn A-A. Tiimanni tn 20;BENU Apteek Eesti OÜ;Ei;Punane;Põhiapteek;Ida-Viru maakond;Suuremas linnas (vähemalt 4000 elanikku);;;
1386;Tondi Selveri Apteek;Harju maakond Tallinn Kristiine linnaosa A. H. Tammsaare tee 62;Terve Pere Apteek OÜ;Ei;Punane;Põhiapteek;Harju maakond;Suuremas linnas (vähemalt 4000 elanikku);;;
1377;Tootsi Apteek;Pärnu maakond Põhja-Pärnumaa vald Tootsi alev Kesk tn 7;Maire Vaarmanni Tootsi Apteek;Jah;Roheline;Põhiapteek;Pärnu maakond;Maal;;;
102;Tori Apteek;Pärnu maakond Tori vald Tori alevik Pärnu mnt 3;OÜ Tori Apteek;Jah;Roheline;Põhiapteek;Pärnu maakond;Maal;;;
154;Torma Apteek;Jõgeva maakond Jõgeva vald Torma alevik Kesk tn 6;Osaühing Torma Apteek;Jah;Roheline;Põhiapteek;Jõgeva maakond;Maal;;;
252;Torupilli Apteek;Harju maakond Tallinn Kesklinna linnaosa Vesivärava tn 37;BENU Apteek Eesti OÜ;Ei;Punane;Põhiapteek;Harju maakond;Suuremas linnas (vähemalt 4000 elanikku);;;
1;Tõnismäe Südameapteek 24h;Harju maakond Tallinn Kesklinna linnaosa Tõnismägi 5;Pharma Group OÜ;Ei;Punane;Põhiapteek;Harju maakond;Suuremas linnas (vähemalt 4000 elanikku);;;
133;Tõrva Südameapteek;Valga maakond - Tõrva linn Tartu tn 4;Pharma Group OÜ;Ei;Punane;Põhiapteek;Valga maakond;Alla 4000 elanikuga linnas;;;
29;Tähe Apteek;Viljandi maakond Viljandi linn Turu tn 8;BENU Apteek Eesti OÜ;Ei;Punane;Põhiapteek;Viljandi maakond;Suuremas linnas (vähemalt 4000 elanikku);;;
1446;Tähesaju Selveri Apteek;Harju maakond Tallinn Lasnamäe linnaosa Tähesaju tee 1;MAPharm OÜ;Jah;Roheline;Põhiapteek;Harju maakond;Suuremas linnas (vähemalt 4000 elanikku);;;
138;Tähtvere Apteek;Tartu maakond - Tartu linn F. Tuglase tn 19;OÜ Pharmandia;Jah;Roheline;Põhiapteek;Tartu maakond;Suuremas linnas (vähemalt 4000 elanikku);;;
1353;Tööstuse Rimi Apteek;Harju maakond Tallinn Põhja-Tallinna linnaosa Tööstuse tn 103;BENU Apteek Eesti OÜ;Ei;Punane;Põhiapteek;Harju maakond;Suuremas linnas (vähemalt 4000 elanikku);;;
122;Türi Apteek;Järva maakond Türi vald Türi linn Paide tn 7b;Türi Apteek Osaühing;Ei;Kollane;Põhiapteek;Järva maakond;Suuremas linnas (vähemalt 4000 elanikku);;;
278;Türi Tervisekeskuse Apteek;Järva maakond Türi vald Türi linn Viljandi tn 26;osaühing Folia Apteek;Jah;Roheline;Põhiapteek;Järva maakond;Suuremas linnas (vähemalt 4000 elanikku);;;
1473;Ujula Konsumi apteek;Tartu maakond, Tartu linn, Tartu linn, Ujula tn 2;osaühing TARTU UUSAPTEEK;Jah;Roheline;Põhiapteek;Tartu maakond;Suuremas linnas (vähemalt 4000 elanikku);;;
105;Uku Keskuse Apteek;Viljandi maakond - Viljandi linn Tallinna tn 41;Terve Pere Apteek OÜ;Ei;Punane;Põhiapteek;Viljandi maakond;Suuremas linnas (vähemalt 4000 elanikku);;;
1324;Uuesilla Apteek;Pärnu maakond - Pärnu linn Riia mnt 131;Osaühing EUROAPTEEK;Ei;Punane;Põhiapteek;Pärnu maakond;Suuremas linnas (vähemalt 4000 elanikku);;;
2293;Uuesilla Apteek HA1;Põlva maakond Räpina vald Räpina linn Pargi tn 1;Osaühing EUROAPTEEK;Ei;Punane;Haruapteek;Põlva maakond;Alla 4000 elanikuga linnas;;;
2297;Uuesilla Apteek HA2;Valga maakond - Tõrva linn Tamme tn 2;Osaühing EUROAPTEEK;Ei;Punane;Haruapteek;Valga maakond;Alla 4000 elanikuga linnas;;;
234;Uus Apteek;Tartu maakond - Tartu linn Pikk tn 60;osaühing TARTU UUSAPTEEK;Jah;Roheline;Põhiapteek;Tartu maakond;Suuremas linnas (vähemalt 4000 elanikku);;;
2062;Uus Apteek HA1;Tartu maakond - Tartu linn L. Puusepa tn 8;osaühing TARTU UUSAPTEEK;Ei;Kollane;Haruapteek;Tartu maakond;Suuremas linnas (vähemalt 4000 elanikku);;;
2187;Uus Apteek HA2;Tartu maakond Nõo vald Nõo alevik Oja tn 12;osaühing TARTU UUSAPTEEK;Jah;Roheline;Haruapteek;Tartu maakond;Maal;;;
79;Uus-Ahtme Apteek;Ida-Viru maakond Kohtla-Järve linn Ahtme linnaosa Puru tee 77;Osaühing EUROAPTEEK;Ei;Punane;Põhiapteek;Ida-Viru maakond;Suuremas linnas (vähemalt 4000 elanikku);;;
1357;Vabaduse Apteek;Harju maakond Tallinn Kesklinna linnaosa Vabaduse väljak 10;Osaühing EUROAPTEEK;Ei;Punane;Põhiapteek;Harju maakond;Suuremas linnas (vähemalt 4000 elanikku);;;
1429;Vaksali Apteek;Tartu maakond - Tartu linn Vaksali tn 17;Vaksali Apteek OÜ;Jah;Roheline;Põhiapteek;Tartu maakond;Suuremas linnas (vähemalt 4000 elanikku);;;
134;Valga Haigla Apteek;Valga maakond - Valga linn Peetri tn 2;OÜ Valga Haigla Apteek;Ei;Punane;Põhiapteek;Valga maakond;Suuremas linnas (vähemalt 4000 elanikku);;;
175;Valga Maxima Südameapteek;Valga maakond - Valga linn Jaama pst 2b;Pharma Group OÜ;Ei;Punane;Põhiapteek;Valga maakond;Suuremas linnas (vähemalt 4000 elanikku);;;
76;Valga Selveri Apteek;Valga maakond Valga vald Valga linn Raja tn 5;Terve Pere Apteek OÜ;Ei;Punane;Põhiapteek;Valga maakond;Suuremas linnas (vähemalt 4000 elanikku);;;
2310;Valga Selveri Apteek HA2;Valga maakond Otepää vald Sangaste alevik Nooruse tn 2;Terve Pere Apteek OÜ;Ei;Punane;Haruapteek;Valga maakond;Maal;;;
1320;Valga Südameapteek;Valga maakond - Valga linn Vabaduse tn 39;Pharma Group OÜ;Ei;Punane;Põhiapteek;Valga maakond;Suuremas linnas (vähemalt 4000 elanikku);;;
211;Vana Apteek;Lääne maakond - Haapsalu linn Posti tn 15;osaühing Akos Apteek;Jah;Roheline;Põhiapteek;Lääne maakond;Suuremas linnas (vähemalt 4000 elanikku);;;
2039;Vana Apteek HA1;Tartu maakond Kambja vald Tõrvandi alevik Papli tn 6;osaühing Akos Apteek;Jah;Roheline;Haruapteek;Tartu maakond;Maal;;;
195;Vana-Vigala Apteek; Rapla maakond Märjamaa vald Vana-Vigala küla Jaama tn 2 ;OÜ VIGALA APTEEK;Ei;Punane;Põhiapteek;Rapla maakond;Maal;;;
2176;Vana-Vigala Apteek HA2;Rapla maakond Märjamaa vald Märjamaa alev Oru tn 12;OÜ VIGALA APTEEK;Ei;Punane;Haruapteek;Rapla maakond;Maal;;;
190;Vastseliina Apteek;Võru maakond Võru vald Vastseliina alevik Võidu tn 22;OÜ Vastseliina Apteek;Jah;Roheline;Põhiapteek;Võru maakond;Maal;;;
7;Veerenni Tervisekeskuse Südameapteek;Harju maakond Tallinn Kesklinna linnaosa Veerenni tn 53a;Veerenni apteek OÜ;Jah;Roheline;Põhiapteek;Harju maakond;Suuremas linnas (vähemalt 4000 elanikku);;;
24;Viimsi Haigla Apteek;Harju maakond Viimsi vald Haabneeme alevik Kaluri tee 5a;Terve Pere Apteek OÜ;Ei;Punane;Põhiapteek;Harju maakond;Maal;;;
307;Vikerlase Südameapteek 24h;Harju maakond Tallinn Lasnamäe linnaosa Vikerlase tn 19;Pharma Group OÜ;Ei;Punane;Põhiapteek;Harju maakond;Suuremas linnas (vähemalt 4000 elanikku);;;
2320;Vikerlase Südameapteek 24h HA1;Harju maakond Kuusalu vald Kuusalu alevik Kuusalu tee 13;Pharma Group OÜ;Ei;Punane;Haruapteek;Harju maakond;Maal;;;
108;Viljandi Apteek;Viljandi maakond - Viljandi linn Tartu tn 1;OÜ Jasmin Apteegid;Ei;Punane;Põhiapteek;Viljandi maakond;Suuremas linnas (vähemalt 4000 elanikku);;;
114;Viljandi Maksimarketi Apteek;Viljandi maakond - Viljandi linn Lääne tn 2;Osaühing Ridaküla Apteek;Jah;Roheline;Põhiapteek;Viljandi maakond;Suuremas linnas (vähemalt 4000 elanikku);;;
